{
  "knowledge_version": "234dfffb4aee",
  "source_workbook": "Parthia Health - HF Knowledge Base.xlsx",
  "sheet": "Source register",
  "notes": [],
  "rows": [
    {
      "source_id": "S01",
      "title": "2022 AHA/ACC/HFSA Guideline for the Management of Heart Failure",
      "organization": "AHA / ACC / HFSA",
      "version": "2022",
      "source_type": "Guideline",
      "scope": "All HF",
      "audience": "Clinician",
      "link": "doi:10.1161/CIR.0000000000001063",
      "license_status": "Copyrighted – permission needed",
      "full_text_storable": "To check",
      "source_status": "Current",
      "date_accessed": null,
      "notes": "Primary U.S. guideline. Write cards in own words."
    },
    {
      "source_id": "S02",
      "title": "2024 ACC Expert Consensus Decision Pathway for Treatment of HFrEF",
      "organization": "ACC",
      "version": "2024",
      "source_type": "Decision pathway",
      "scope": "HFrEF",
      "audience": "Clinician",
      "link": "Add link/DOI",
      "license_status": "Copyrighted – permission needed",
      "full_text_storable": "To check",
      "source_status": "Current",
      "date_accessed": null,
      "notes": "Sequencing, titration, monitoring during dose changes."
    },
    {
      "source_id": "S03",
      "title": "2026 ACC Expert Consensus Decision Pathway: Management of HFpEF",
      "organization": "ACC",
      "version": "2026",
      "source_type": "Decision pathway",
      "scope": "HFpEF",
      "audience": "Clinician",
      "link": "Add link/DOI",
      "license_status": "Copyrighted – permission needed",
      "full_text_storable": "To check",
      "source_status": "Current",
      "date_accessed": null,
      "notes": "Key for Margaret persona (HFpEF)."
    },
    {
      "source_id": "S04",
      "title": "2026 AHA/ACC/ADA/ASN Guideline: Cardiovascular-Kidney-Metabolic Syndrome",
      "organization": "AHA / ACC / ADA / ASN",
      "version": "2026",
      "source_type": "Guideline",
      "scope": "Kidney / diabetes",
      "audience": "Clinician",
      "link": "doi:10.1161/CIR.0000000000001453",
      "license_status": "Copyrighted – permission needed",
      "full_text_storable": "To check",
      "source_status": "Current",
      "date_accessed": null,
      "notes": "Diabetes and CKD overlap."
    },
    {
      "source_id": "S05",
      "title": "Second Universal Definition of Heart Failure",
      "organization": "AHA / ACC / ESC / WHF",
      "version": "2026",
      "source_type": "Consensus definition",
      "scope": "All HF",
      "audience": "Clinician",
      "link": "doi:10.1161/CIR.0000000000001455",
      "license_status": "Copyrighted – permission needed",
      "full_text_storable": "To check",
      "source_status": "Current",
      "date_accessed": null,
      "notes": "Terminology for the data model."
    },
    {
      "source_id": "S06",
      "title": "2026 ESC Guidelines for the Management of Heart Failure",
      "organization": "ESC",
      "version": "2026",
      "source_type": "Guideline",
      "scope": "All HF",
      "audience": "Clinician",
      "link": "Add link/DOI",
      "license_status": "Copyrighted – permission needed",
      "full_text_storable": "To check",
      "source_status": "Current",
      "date_accessed": null,
      "notes": "Secondary reference. Uses different LVEF categories than U.S."
    },
    {
      "source_id": "S07",
      "title": "Drugs That May Cause or Exacerbate Heart Failure (AHA Scientific Statement, Page et al.)",
      "organization": "AHA",
      "version": "2016",
      "source_type": "Scientific statement",
      "scope": "All HF",
      "audience": "Clinician",
      "link": "Add link/DOI",
      "license_status": "Copyrighted – permission needed",
      "full_text_storable": "To check",
      "source_status": "To verify",
      "date_accessed": null,
      "notes": "Core for pharmacist agent. Check for a newer update."
    },
    {
      "source_id": "S08",
      "title": "AGS Beers Criteria for Potentially Inappropriate Medication Use in Older Adults",
      "organization": "American Geriatrics Society",
      "version": "Latest edition",
      "source_type": "Criteria",
      "scope": "Older adults",
      "audience": "Clinician",
      "link": "Add link/DOI",
      "license_status": "Copyrighted – permission needed",
      "full_text_storable": "To check",
      "source_status": "To verify",
      "date_accessed": null,
      "notes": "Confirm latest edition year."
    },
    {
      "source_id": "S09",
      "title": "FDA drug labels (Structured Product Labeling)",
      "organization": "NLM DailyMed / FDA",
      "version": "Per drug",
      "source_type": "Drug label",
      "scope": "Drug information",
      "audience": "Clinician",
      "link": "https://dailymed.nlm.nih.gov",
      "license_status": "Public domain",
      "full_text_storable": "Yes",
      "source_status": "Current",
      "date_accessed": null,
      "notes": "Use SPL XML, not PDF. ~30 drugs for MVP."
    },
    {
      "source_id": "S10",
      "title": "RxNorm",
      "organization": "National Library of Medicine",
      "version": "Monthly",
      "source_type": "Terminology",
      "scope": "Drug information",
      "audience": "Clinician",
      "link": "https://www.nlm.nih.gov/research/umls/rxnorm",
      "license_status": "Free with registration",
      "full_text_storable": "Yes",
      "source_status": "Current",
      "date_accessed": null,
      "notes": "Drug names and codes."
    },
    {
      "source_id": "S11",
      "title": "Licensed drug-interaction database (Lexicomp, Medi-Span or First Databank)",
      "organization": "Vendor",
      "version": "Current",
      "source_type": "Drug database",
      "scope": "Drug information",
      "audience": "Clinician",
      "link": "Add link/DOI",
      "license_status": "Licensed product – purchase",
      "full_text_storable": "No",
      "source_status": "To verify",
      "date_accessed": null,
      "notes": "Replaces illustrative interaction tables."
    },
    {
      "source_id": "S12",
      "title": "HFSA / AHA heart failure patient education",
      "organization": "HFSA / AHA",
      "version": "Current",
      "source_type": "Patient education",
      "scope": "Self-care",
      "audience": "Patient",
      "link": "Add link/DOI",
      "license_status": "To check",
      "full_text_storable": "To check",
      "source_status": "To verify",
      "date_accessed": null,
      "notes": "Plain-language explanations; self-care thresholds."
    },
    {
      "source_id": "S13",
      "title": "SODIUM-HF trial (Lancet, 2022)",
      "organization": "Ezekowitz et al.",
      "version": "2022",
      "source_type": "Trial",
      "scope": "All HF",
      "audience": "Clinician",
      "link": "Add link/DOI",
      "license_status": "Copyrighted – permission needed",
      "full_text_storable": "No",
      "source_status": "Current",
      "date_accessed": null,
      "notes": "Nuance on sodium restriction."
    },
    {
      "source_id": "S14",
      "title": "Kansas City Cardiomyopathy Questionnaire (KCCQ-12)",
      "organization": "CV Outcomes",
      "version": "Current",
      "source_type": "Questionnaire",
      "scope": "All HF",
      "audience": "Patient",
      "link": "Add link/DOI",
      "license_status": "To check",
      "full_text_storable": "To check",
      "source_status": "To verify",
      "date_accessed": null,
      "notes": "May require a license for commercial use."
    },
    {
      "source_id": "S16",
      "title": "LOINC (lab and observation codes)",
      "organization": "Regenstrief Institute",
      "version": "Current",
      "source_type": "Terminology",
      "scope": "Drug information",
      "audience": "Clinician",
      "link": "https://loinc.org",
      "license_status": "Free with registration",
      "full_text_storable": "Yes",
      "source_status": "Current",
      "date_accessed": null,
      "notes": "Codes for labs, vitals and questionnaires."
    },
    {
      "source_id": "S17",
      "title": "SNOMED CT (clinical terms)",
      "organization": "SNOMED International / NLM",
      "version": "Current",
      "source_type": "Terminology",
      "scope": "All HF",
      "audience": "Clinician",
      "link": "https://www.nlm.nih.gov/healthit/snomedct",
      "license_status": "Free with registration",
      "full_text_storable": "Yes",
      "source_status": "Current",
      "date_accessed": null,
      "notes": "Codes for diagnoses and conditions (free in the U.S. via UMLS license)."
    },
    {
      "source_id": "S15",
      "title": "PHQ-2 / PHQ-9",
      "organization": "Pfizer (free to use)",
      "version": "Current",
      "source_type": "Questionnaire",
      "scope": "All HF",
      "audience": "Patient",
      "link": "Add link/DOI",
      "license_status": "To check",
      "full_text_storable": "Yes",
      "source_status": "Current",
      "date_accessed": null,
      "notes": "Depression screening; item 9 safety response."
    }
  ]
}
